<station xmlns:xsi="http://www.w3.org/2001/XMLSchema-instance" xsi:noNamespaceSchemaLocation="file:///C:/Users/Timo/Documents/git/oscar-lib/oscar_lib/static/xml-schemas/simplestation.xsd">
	<name>Novo Aripuan√£</name>
	<wigosid>0-76-0-1303304000000594</wigosid>
	<latitude>-5.141139</latitude>
	<longitude>-60.380531000000005</longitude>
	<elevation>45.0</elevation>
	<country>BRA</country>
	<established>2019-07-18</established>
	<region>southAmerica</region>
	<urls>
		<url>https://test.de</url>
		<url>https://test.de/2</url>
	</urls>
	<observations>
		<observation>
			<variable>224</variable>
			<observationsource>automaticReading</observationsource>
			<affiliation>GOS</affiliation>
			<schedule>
				<startMonth>1</startMonth>
				<endMonth>12</endMonth>
				<startWeekday>1</startWeekday>
				<endWeekday>7</endWeekday>
				<startHour>0</startHour>
				<endHour>23</endHour>
				<startMinute>0</startMinute>
				<endMinute>59</endMinute>
				<interval>3600</interval>
				<international>true</international>
				<real-time>true</real-time>
			</schedule>
		</observation>
		<observation>
			<variable>251</variable>
			<observationsource>automaticReading</observationsource>
			<affiliation>GOS</affiliation>
			<schedule>
				<startMonth>1</startMonth>
				<endMonth>12</endMonth>
				<startWeekday>1</startWeekday>
				<endWeekday>7</endWeekday>
				<startHour>0</startHour>
				<endHour>23</endHour>
				<startMinute>0</startMinute>
				<endMinute>59</endMinute>
				<interval>3600</interval>
				<international>true</international>
				<real-time>true</real-time>
			</schedule>
		</observation>
		<observation>
			<variable>225</variable>
			<observationsource>automaticReading</observationsource>
			<affiliation>GOS</affiliation>
			<schedule>
				<startMonth>1</startMonth>
				<endMonth>12</endMonth>
				<startWeekday>1</startWeekday>
				<endWeekday>7</endWeekday>
				<startHour>0</startHour>
				<endHour>23</endHour>
				<startMinute>0</startMinute>
				<endMinute>59</endMinute>
				<interval>3600</interval>
				<international>true</international>
				<real-time>true</real-time>
			</schedule>
		</observation>
		<observation>
			<variable>216</variable>
			<observationsource>automaticReading</observationsource>
			<affiliation>GOS</affiliation>
			<schedule>
				<startMonth>1</startMonth>
				<endMonth>12</endMonth>
				<startWeekday>1</startWeekday>
				<endWeekday>7</endWeekday>
				<startHour>0</startHour>
				<endHour>23</endHour>
				<startMinute>0</startMinute>
				<endMinute>59</endMinute>
				<interval>3600</interval>
				<international>true</international>
				<real-time>true</real-time>
			</schedule>
		</observation>
		<observation>
			<variable>12005</variable>
			<observationsource>automaticReading</observationsource>
			<affiliation>GOS</affiliation>
			<schedule>
				<startMonth>1</startMonth>
				<endMonth>12</endMonth>
				<startWeekday>1</startWeekday>
				<endWeekday>7</endWeekday>
				<startHour>0</startHour>
				<endHour>23</endHour>
				<startMinute>0</startMinute>
				<endMinute>59</endMinute>
				<interval>3600</interval>
				<international>true</international>
				<real-time>true</real-time>
			</schedule>
		</observation>
		<observation>
			<variable>12006</variable>
			<observationsource>automaticReading</observationsource>
			<affiliation>GOS</affiliation>
			<schedule>
				<startMonth>1</startMonth>
				<endMonth>12</endMonth>
				<startWeekday>1</startWeekday>
				<endWeekday>7</endWeekday>
				<startHour>0</startHour>
				<endHour>23</endHour>
				<startMinute>0</startMinute>
				<endMinute>59</endMinute>
				<interval>3600</interval>
				<international>true</international>
				<real-time>true</real-time>
			</schedule>
		</observation>
		<observation>
			<variable>572</variable>
			<observationsource>automaticReading</observationsource>
			<affiliation>GOS</affiliation>
			<schedule>
				<startMonth>1</startMonth>
				<endMonth>12</endMonth>
				<startWeekday>1</startWeekday>
				<endWeekday>7</endWeekday>
				<startHour>0</startHour>
				<endHour>23</endHour>
				<startMinute>0</startMinute>
				<endMinute>59</endMinute>
				<interval>3600</interval>
				<international>true</international>
				<real-time>true</real-time>
			</schedule>
		</observation>
		<observation>
			<variable>210</variable>
			<observationsource>automaticReading</observationsource>
			<affiliation>GOS</affiliation>
			<schedule>
				<startMonth>1</startMonth>
				<endMonth>12</endMonth>
				<startWeekday>1</startWeekday>
				<endWeekday>7</endWeekday>
				<startHour>0</startHour>
				<endHour>23</endHour>
				<startMinute>0</startMinute>
				<endMinute>59</endMinute>
				<interval>3600</interval>
				<international>true</international>
				<real-time>true</real-time>
			</schedule>
		</observation>
	</observations>
	<stationtype>landFixed</stationtype>
	<status>operational</status>
	<description>Automatic weather station</description>
	<timezone>UTC-4</timezone>
	<organization>INMET</organization>
	<affiliations>
		<affiliation>GOS</affiliation>
		<affiliation>GOS</affiliation>
		<affiliation>GOS</affiliation>
		<affiliation>GOS</affiliation>
		<affiliation>GOS</affiliation>
		<affiliation>GOS</affiliation>
		<affiliation>GOS</affiliation>
		<affiliation>GOS</affiliation>
	</affiliations>
</station>
